{"assessments":[{"assumption_id":"linearity","rationale":"Structural example only; runtime requires actual independent plan provenance.","scenario_ids":[],"status":"NOT_APPLICABLE"}],"blockers":[],"checks":[],"created_at":"2026-09-08T00:00:00Z","experiments":[],"plan":{"path":"reviews/assumptions.json","sha256":"0000000000000000000000000000000000000000000000000000000000000000"},"producer":"assumption-assessment-service","question_id":"Q1","schema_version":"2.0","scope":"declared_assumption_checks","status":"PASS"}
